{
  "$schema": "https://json-schema.org/draft/2020-12/schema",
  "$id": "https://openpuffer.dev/benchmarks/report/schema/large-aws-l1.schema.json",
  "title": "openpuffer large-aws L1 bench-large JSON",
  "description": "Schema for benchmarks/results/large-aws-l1*.json and report fixtures (bench-large.sh output).",
  "type": "object",
  "additionalProperties": true,
  "required": [
    "benchmark",
    "environment",
    "tier",
    "workload_dir",
    "namespace",
    "primary_query",
    "namespace_docs",
    "dimensions",
    "seed",
    "embedding_fn",
    "p50_query_latency_ms",
    "p95_query_latency_ms",
    "recall_at_10",
    "index_cursor_eq_wal_commit_seq",
    "cold_query_runs"
  ],
  "properties": {
    "benchmark": { "const": "cold_large_l1" },
    "environment": { "type": "string", "minLength": 1 },
    "tier": { "const": "l1" },
    "workload_dir": { "type": "string", "minLength": 1 },
    "namespace": { "type": "string", "minLength": 1 },
    "primary_query": { "type": "string", "minLength": 1 },
    "namespace_docs": { "type": "integer", "minimum": 1 },
    "dimensions": { "type": "integer", "minimum": 1 },
    "seed": { "type": "integer" },
    "embedding_fn": { "type": "string", "minLength": 1 },
    "cache_dir": { "type": "string" },
    "consistency": { "type": "string" },
    "preferred_ann_version": { "type": ["integer", "null"] },
    "index_cursor_eq_wal_commit_seq": { "type": "boolean" },
    "storage_roundtrips": { "type": ["integer", "null"] },
    "cold_s3_keys_fetched": { "type": ["integer", "null"] },
    "s3_get_count": { "type": ["integer", "null"] },
    "s3_get_count_note": { "type": "string" },
    "p50_query_latency_ms": { "type": "number", "minimum": 0 },
    "p95_query_latency_ms": { "type": "number", "minimum": 0 },
    "p50_warm_query_latency_ms": { "type": ["number", "null"], "minimum": 0 },
    "p95_warm_query_latency_ms": { "type": ["number", "null"], "minimum": 0 },
    "warm_query_runs": { "type": ["integer", "null"], "minimum": 0 },
    "warm_consistency": { "type": ["string", "null"] },
    "warm_cache_dir": { "type": ["string", "null"] },
    "candidates_ratio": { "type": ["number", "null"] },
    "recall_at_10": { "type": "number", "minimum": 0, "maximum": 1 },
    "cold_query_runs": { "type": "integer", "minimum": 1 },
    "cold_runs": {
      "type": "array",
      "items": { "$ref": "#/$defs/cold_run" }
    },
    "filter_query_runs": {
      "type": "array",
      "items": { "$ref": "#/$defs/secondary_query_run" }
    },
    "hybrid_query_runs": {
      "type": "array",
      "items": { "$ref": "#/$defs/secondary_query_run" }
    },
    "warm_runs": {
      "type": "array",
      "items": { "$ref": "#/$defs/warm_vector_run" }
    },
    "warm_filter_query_runs": {
      "type": "array",
      "items": { "$ref": "#/$defs/secondary_query_run" }
    },
    "warm_hybrid_query_runs": {
      "type": "array",
      "items": { "$ref": "#/$defs/secondary_query_run" }
    },
    "index_keys_total": { "type": ["integer", "null"] },
    "index_object_count": { "type": ["integer", "null"] },
    "ingest_summary_path": { "type": "string" },
    "ingest_elapsed_secs": { "type": "number", "minimum": 0 },
    "index_wait_sec": { "type": "number", "minimum": 0 },
    "ingest_total_wall_sec": { "type": "number", "minimum": 0 },
    "ingest_docs_per_sec": { "type": "number", "minimum": 0 },
    "ingest_batches_per_sec": { "type": "number", "minimum": 0 },
    "ingest_timing": { "$ref": "#/$defs/ingest_timing_embed" },
    "notes": { "type": "string" }
  },
  "$defs": {
    "cold_run": {
      "type": "object",
      "additionalProperties": true,
      "required": ["run", "query_name", "latency_ms"],
      "properties": {
        "run": { "type": "integer", "minimum": 1 },
        "query_name": { "type": "string" },
        "latency_ms": { "type": "number", "minimum": 0 },
        "storage_roundtrips": { "type": ["integer", "null"] },
        "candidates_ratio": { "type": ["number", "null"] },
        "cold_s3_keys_fetched": { "type": ["integer", "null"] }
      }
    },
    "secondary_query_run": {
      "type": "object",
      "additionalProperties": true,
      "required": ["query_name", "query_kind", "latency_ms"],
      "properties": {
        "query_name": { "type": "string" },
        "query_kind": { "enum": ["filter", "hybrid"] },
        "latency_ms": { "type": "number", "minimum": 0 },
        "candidates_ratio": { "type": ["number", "null"] },
        "storage_roundtrips": { "type": ["integer", "null"] },
        "result_rows": { "type": ["integer", "null"], "minimum": 0 },
        "phase": { "enum": ["cold", "warm"] }
      }
    },
    "warm_vector_run": {
      "type": "object",
      "additionalProperties": true,
      "required": ["run", "query_name", "latency_ms"],
      "properties": {
        "run": { "type": "integer", "minimum": 1 },
        "query_name": { "type": "string" },
        "latency_ms": { "type": "number", "minimum": 0 },
        "candidates_ratio": { "type": ["number", "null"] },
        "consistency": { "type": "string" }
      }
    },
    "batch_latency_ms": {
      "type": "object",
      "additionalProperties": false,
      "required": ["p50", "p95", "min", "max"],
      "properties": {
        "p50": { "type": "number", "minimum": 0 },
        "p95": { "type": "number", "minimum": 0 },
        "min": { "type": "number", "minimum": 0 },
        "max": { "type": "number", "minimum": 0 }
      }
    },
    "ingest_batch_run": {
      "type": "object",
      "additionalProperties": true,
      "required": ["batch", "file", "latency_ms"],
      "properties": {
        "batch": { "type": "integer", "minimum": 1 },
        "file": { "type": "string" },
        "latency_ms": { "type": "number", "minimum": 0 }
      }
    },
    "ingest_timing_embed": {
      "type": "object",
      "additionalProperties": true,
      "required": [
        "upsert_wall_sec",
        "index_wait_sec",
        "total_wall_sec",
        "batch_count",
        "batches_per_sec",
        "docs_per_sec",
        "batch_latency_ms",
        "batch_runs"
      ],
      "properties": {
        "upsert_wall_sec": { "type": "number", "minimum": 0 },
        "index_wait_sec": { "type": "number", "minimum": 0 },
        "total_wall_sec": { "type": "number", "minimum": 0 },
        "batch_count": { "type": "integer", "minimum": 0 },
        "batches_per_sec": { "type": "number", "minimum": 0 },
        "docs_per_sec": { "type": "number", "minimum": 0 },
        "batch_latency_ms": { "$ref": "#/$defs/batch_latency_ms" },
        "batch_runs": {
          "type": "array",
          "items": { "$ref": "#/$defs/ingest_batch_run" }
        }
      }
    }
  }
}