{
  "benchmark": "cold_large_l1",
  "environment": "aws-s3",
  "tier": "l1",
  "workload_dir": "benchmarks/workloads/synthetic-128/l1-100k",
  "namespace": "bench-large-100000",
  "primary_query": "vector-q00",
  "namespace_docs": 100000,
  "dimensions": 128,
  "seed": 42,
  "embedding_fn": "bench_sin_v1",
  "cache_dir": "",
  "consistency": "strong",
  "preferred_ann_version": 3,
  "index_cursor_eq_wal_commit_seq": true,
  "storage_roundtrips": 3,
  "cold_s3_keys_fetched": 12,
  "s3_get_count": 0,
  "s3_get_count_note": "segment cache counter; cold path uses s3_batch (see cold_s3_keys_fetched)",
  "p50_query_latency_ms": 420,
  "p95_query_latency_ms": 510,
  "p50_warm_query_latency_ms": 18,
  "p95_warm_query_latency_ms": 24,
  "warm_query_runs": 20,
  "warm_consistency": "eventual",
  "warm_cache_dir": "/tmp/openpuffer-bench-warm-l1",
  "warm_runs": [],
  "candidates_ratio": 0.0016,
  "recall_at_10": 0.92,
  "cold_query_runs": 7,
  "cold_runs": [],
  "index_keys_total": 180,
  "index_object_count": 175,
  "ingest_summary_path": "benchmarks/report/fixtures/ingest-large-l1.json",
  "ingest_elapsed_secs": 110,
  "index_wait_sec": 8,
  "ingest_total_wall_sec": 118,
  "ingest_docs_per_sec": 909.09,
  "ingest_batches_per_sec": 0.0909,
  "ingest_timing": {
    "upsert_wall_sec": 110,
    "index_wait_sec": 8,
    "total_wall_sec": 118,
    "batch_count": 10,
    "batches_per_sec": 0.0909,
    "docs_per_sec": 909.09,
    "batch_latency_ms": {
      "p50": 95,
      "p95": 140,
      "min": 72,
      "max": 155
    },
    "batch_runs": []
  },
  "notes": "fixture for render-report tests"
}